Symbol,Name,Last Sale,Net Change,% Change,Market Cap,Country,IPO Year,Volume,Sector,Industry
CROX,Crocs Inc. Common Stock,$77.41,0.99,1.295%,4772357000.00,United States,2006,1303727,Consumer Discretionary,Shoe Manufacturing
CRSP,CRISPR Therapeutics AG Common Shares,$75.01,2.82,3.906%,5851474593.00,Switzerland,2016,1679840,Health Care,Biotechnology: Biological Products (No Diagnostic Substances)
CRSR,Corsair Gaming Inc. Common Stock,$13.90,-0.12,-0.856%,1331506090.00,United States,2020,454532,Technology,Computer Manufacturing
CRTO,Criteo S.A. American Depositary Shares,$28.34,0.13,0.461%,1717685700.00,France,2013,121307,Consumer Discretionary,Advertising
CRUS,Cirrus Logic Inc. Common Stock,$74.93,0.94,1.27%,4191611475.00,United States,1989,635330,Technology,Semiconductors
CRVL,CorVel Corp. Common Stock,$152.16,0.00,0.00%,2648339018.00,United States,,43496,Finance,Specialty Insurers
CRVS,Corvus Pharmaceuticals Inc. Common Stock,$0.955,0.01,1.058%,44458603.00,United States,2016,98747,Health Care,Biotechnology: Pharmaceutical Preparations
CRWD,CrowdStrike Holdings Inc. Class A Common Stock,$178.86,-5.25,-2.852%,41742436945.00,United States,2019,2757485,Technology,EDP Services
CRWS,Crown Crafts Inc Common Stock,$6.00,0.12,2.041%,60418518.00,United States,,21304,,
CRZN,Corazon Capital V838 Monoceros Corp Class A Ordinary Shares,$9.89,-0.02,-0.202%,251946514.00,United States,2021,26101,Finance,Business Services
CRZNU,Corazon Capital V838 Monoceros Corp Unit,$9.91,0.03,0.304%,0.00,United States,2021,9366,Finance,Business Services
CSBR,Champions Oncology Inc. Common Stock,$8.75,0.97,12.468%,118321359.00,United States,,31946,Health Care,Biotechnology: Biological Products (No Diagnostic Substances)
CSCO,Cisco Systems Inc. Common Stock (DE),$43.29,-0.67,-1.524%,177871863989.00,United States,1990,18143766,Telecommunications,Computer Communications Equipment
CSCW,Color Star Technology Co. Ltd. Ordinary Shares,$0.0713,-0.0468,-39.627%,13346471.00,United States,,164321516,Consumer Discretionary,Engineering & Construction
CSGP,CoStar Group Inc. Common Stock,$72.49,-1.48,-2.001%,28702373818.00,United States,1998,4374835,Finance,Real Estate
CSGS,CSG Systems International Inc. Common Stock,$54.34,-0.785,-1.424%,1743381254.00,United States,1996,150921,Technology,EDP Services
CSII,Cardiovascular Systems Inc. Common Stock,$14.18,-0.28,-1.936%,580882566.00,United States,1981,277740,Health Care,Medical/Dental Instruments
CSIQ,Canadian Solar Inc. Common Shares (BC),$40.38,-2.04,-4.809%,2595174992.00,Canada,2006,1091005,,
CSLM,Consilium Acquisition Corp I Ltd. Class A Ordinary Share,$9.90,-0.02,-0.202%,234815625.00,United States,2022,445002,,
CSPI,CSP Inc. Common Stock,$8.29,-0.06,-0.719%,37767715.00,United States,1982,3406,Technology,EDP Services
CSQ,Calamos Strategic Total Return Common Stock,$14.14,-0.11,-0.772%,2232351722.00,United States,2004,211166,Finance,Finance Companies
CSSE,Chicken Soup for the Soul Entertainment Inc. Class A Common Stock,$8.50,-0.38,-4.279%,107515633.00,United States,2017,157087,Consumer Discretionary,Movies/Entertainment
CSSEL,Chicken Soup for the Soul Entertainment Inc. Warrant,$0.085,-0.005,-5.556%,0.00,United States,,151087,Consumer Discretionary,Movies/Entertainment
CSSEN,Chicken Soup for the Soul Entertainment Inc. 9.50% Notes due 2025,$25.00,-0.05,-0.20%,0.00,United States,,3617,Consumer Discretionary,Movies/Entertainment
CSSEP,Chicken Soup for the Soul Entertainment Inc. 9.75% Series A Cumulative Redeemable Perpetual Preferred Stock,$23.5994,0.1494,0.637%,0.00,United States,,4235,Consumer Discretionary,Movies/Entertainment
CSTE,Caesarstone Ltd. Ordinary Shares,$9.51,0.01,0.105%,327866712.00,Israel,2012,51981,Consumer Discretionary,Multi-Sector Companies
CSTL,Castle Biosciences Inc. Common Stock,$28.42,0.07,0.247%,747359831.00,United States,2019,126996,Health Care,Medical Specialities
CSTR,CapStar Financial Holdings Inc. Common Stock,$19.79,0.43,2.221%,434331585.00,United States,2016,53293,Finance,Major Banks
CSWC,Capital Southwest Corporation Common Stock,$18.28,0.07,0.384%,503259551.00,United States,,143297,Finance,Finance/Investors Services
CSWI,CSW Industrials Inc. Common Stock,$124.92,-1.88,-1.483%,1927187435.00,United States,,61135,Industrials,Home Furnishings
CSX,CSX Corporation Common Stock,$30.17,-1.06,-3.394%,64601245073.00,United States,,34763098,Industrials,Railroads
CTAQ,Carney Technology Acquisition Corp. II Class A Common Stock,$9.94,0.00,0.00%,509052250.00,United States,2021,60655,Industrials,Consumer Electronics/Appliances
CTAQU,Carney Technology Acquisition Corp. II Units,$9.9601,0.0301,0.303%,0.00,United States,2020,1473,Industrials,Consumer Electronics/Appliances
CTAS,Cintas Corporation Common Stock,$398.57,-4.32,-1.072%,40330535437.00,United States,1983,462337,Consumer Discretionary,Business Services
CTBI,Community Trust Bancorp Inc. Common Stock,$41.91,0.09,0.215%,750246542.00,United States,,42710,Finance,Major Banks
CTG,Computer Task Group Inc. Common Stock,$7.41,-0.01,-0.135%,114997198.00,United States,,26398,Technology,EDP Services
CTHR,Charles & Colvard Ltd Common Stock,$1.09,0.04,3.81%,33264097.00,United States,1997,218880,Consumer Discretionary,Consumer Specialties
CTIB,Yunhong CTI Ltd. Common Stock,$0.8402,0.0189,2.301%,4967052.00,United States,1997,12118,Miscellaneous,Diversified Commercial Services
CTIC,CTI BioPharma Corp. (DE) Common Stock,$6.19,-0.44,-6.637%,708045050.00,United States,1997,4588874,Health Care,Biotechnology: Pharmaceutical Preparations
CTKB,Cytek Biosciences Inc. Common Stock,$13.89,-0.34,-2.389%,1869969586.00,United States,2021,962953,Health Care,Biotechnology: Electromedical & Electrotherapeutic Apparatus
CTLP,Cantaloupe Inc. Common Stock,$4.58,0.12,2.691%,326041283.00,United States,,493113,Technology,EDP Services
CTMX,CytomX Therapeutics Inc. Common Stock,$1.66,0.03,1.84%,109477402.00,United States,2015,301784,Health Care,Biotechnology: Pharmaceutical Preparations
CTRM,Castor Maritime Inc. Common Shares,$1.32,0.02,1.538%,124885316.00,Cyprus,,473322,Consumer Discretionary,Marine Transportation
CTRN,Citi Trends Inc. Common Stock,$18.97,-0.02,-0.105%,158957446.00,United States,2005,193214,,
CTSH,Cognizant Technology Solutions Corporation Class A Common Stock,$62.04,0.01,0.016%,32123376871.00,United States,1998,3196018,Technology,EDP Services
CTSO,Cytosorbents Corporation Common Stock,$1.92,0.06,3.226%,83668664.00,United States,,70940,Health Care,Medical/Dental Instruments
CTXR,Citius Pharmaceuticals Inc. Common Stock,$1.23,0.00,0.00%,179739445.00,United States,,313948,Health Care,Biotechnology: Pharmaceutical Preparations
CTXS,Citrix Systems Inc. Common Stock,$103.61,-0.03,-0.029%,13146563242.00,United States,1995,1183221,Technology,Computer Software: Prepackaged Software
CUBA,Herzfeld Caribbean Basin Fund Inc. (The) Common Stock,$4.21,0.00,0.00%,27589401.00,United States,,2788,Finance,Investment Managers
CUE,Cue Biopharma Inc. Common Stock,$3.27,-0.04,-1.208%,115698300.00,United States,2018,54011,Health Care,Biotechnology: Pharmaceutical Preparations
CUEN,Cuentas Inc. Common Stock,$0.64,-0.01,-1.538%,10701242.00,United States,,17296,Technology,Computer Software: Prepackaged Software
CUENW,Cuentas Inc. Warrant,$0.15,0.00,0.00%,0.00,United States,,200,Technology,Computer Software: Prepackaged Software
CULL,Cullman Bancorp Inc. Common Stock,$11.15,-0.06,-0.535%,82575707.00,United States,2021,12252,Finance,Savings Institutions
CURI,CuriosityStream Inc. Class A Common Stock,$1.70,0.07,4.294%,89746388.00,United States,2020,87886,Industrials,Broadcasting
CURIW,CuriosityStream Inc. Warrant,$0.2499,0.0499,24.95%,0.00,United States,2020,420,Industrials,Broadcasting
CUTR,Cutera Inc. Common Stock,$50.67,-0.36,-0.705%,991886227.00,United States,2004,177955,Health Care,Biotechnology: Electromedical & Electrotherapeutic Apparatus
CVAC,CureVac N.V. Ordinary Shares,$9.64,0.03,0.312%,1807181437.00,Germany,2020,168581,Health Care,Biotechnology: Pharmaceutical Preparations
CVBF,CVB Financial Corporation Common Stock,$25.96,0.32,1.248%,3629130094.00,United States,,569661,Finance,Major Banks
CVCO,Cavco Industries Inc. Common Stock When Issued,$205.30,0.09,0.044%,1826050499.00,United States,,58125,Consumer Discretionary,Homebuilding
CVCY,Central Valley Community Bancorp Common Stock,$18.45,0.20,1.096%,216220089.00,United States,,4541,Finance,Major Banks
CVET,Covetrus Inc. Common Stock,$20.88,0.00,0.00%,2922591077.00,United States,,1106386,Health Care,Other Pharmaceuticals
CVGI,Commercial Vehicle Group Inc. Common Stock,$5.86,-0.03,-0.509%,195754572.00,United States,2004,159666,Consumer Discretionary,Auto Parts:O.E.M.
CVGW,Calavo Growers Inc. Common Stock,$34.72,-0.30,-0.857%,615643270.00,United States,,96003,Consumer Discretionary,Specialty Foods
CVLG,Covenant Logistics Group Inc. Class A Common Stock,$28.97,0.09,0.312%,418708683.00,United States,,76840,Industrials,Trucking Freight/Courier Services
CVLT,Commvault Systems Inc. Common Stock,$51.08,-0.26,-0.506%,2288720106.00,United States,2006,196804,Technology,Computer Software: Prepackaged Software
CVLY,Codorus Valley Bancorp Inc Common Stock,$19.96,0.15,0.757%,190433769.00,United States,,37560,Finance,Savings Institutions
CVRX,CVRx Inc. Common Stock,$8.23,0.19,2.363%,169342142.00,United States,2021,25799,Health Care,Biotechnology: Electromedical & Electrotherapeutic Apparatus
CVT,Cvent Holding Corp. Common Stock,$5.60,0.08,1.449%,2703504877.00,United States,1987,3190463,Technology,Computer Software: Prepackaged Software
CVV,CVD Equipment Corporation Common Stock,$4.91,-0.09,-1.80%,33039086.00,United States,,6010,Technology,Industrial Machinery/Components
CWBC,Community West Bancshares Common Stock,$14.01,0.00,0.00%,122540749.00,United States,,144,Finance,Major Banks
CWBR,CohBar Inc. Common Stock,$0.175,0.0035,2.041%,15251219.00,United States,,590980,Health Care,Biotechnology: In Vitro & In Vivo Diagnostic Substances
CWCO,Consolidated Water Co. Ltd. Ordinary Shares,$18.14,0.25,1.397%,277386558.00,Cayman Islands,,346202,Utilities,Water Supply
CWST,Casella Waste Systems Inc. Class A Common Stock,$82.45,-1.48,-1.763%,4260854480.00,United States,1997,161383,Utilities,Environmental Services
CXDO,Crexendo Inc. Common Stock,$2.72,0.04,1.493%,61401726.00,United States,,12347,Consumer Discretionary,Telecommunications Equipment
CYAD,Celyad Oncology SA American Depositary Shares,$1.8465,-0.0335,-1.782%,41719740.00,Belgium,2015,966,Health Care,Biotechnology: Pharmaceutical Preparations
CYAN,Cyanotech Corporation Common Stock,$2.15,-0.03,-1.376%,13346086.00,United States,,5157,Consumer Staples,Farming/Seeds/Milling
CYBE,CyberOptics Corporation Common Stock,$53.50,0.10,0.187%,397051374.00,United States,1987,163322,Technology,Electronic Components
CYBR,CyberArk Software Ltd. Ordinary Shares,$153.20,1.63,1.075%,6237741603.00,Israel,2014,423343,Technology,Computer Software: Prepackaged Software
CYCC,Cyclacel Pharmaceuticals Inc. Common Stock,$1.58,0.01,0.637%,19811919.00,United States,,167204,Health Care,Biotechnology: Pharmaceutical Preparations
CYCN,Cyclerion Therapeutics Inc. Common Stock,$0.9199,0.0136,1.501%,39997100.00,United States,,111398,Health Care,Biotechnology: Pharmaceutical Preparations
CYN,Cyngn Inc. Common Stock,$1.20,-0.01,-0.826%,40353074.00,United States,2021,255791,Technology,EDP Services
CYRN,CYREN Ltd. Ordinary Shares,$1.29,-0.01,-0.769%,10063175.00,United States,,65174,Technology,Computer Software: Prepackaged Software
CYRX,CryoPort Inc. Common Stock,$31.81,-0.43,-1.334%,1542460633.00,United States,,546449,,
CYT,Cyteir Therapeutics Inc. Common Stock,$2.20,0.08,3.774%,77909537.00,United States,2021,27264,Health Care,Biotechnology: Pharmaceutical Preparations
CYTH,Cyclo Therapeutics Inc. Common Stock,$1.93,0.00,0.00%,16288110.00,United States,,11092,Health Care,Biotechnology: Pharmaceutical Preparations
CYTK,Cytokinetics Incorporated Common Stock,$54.51,0.21,0.387%,5131794727.00,United States,2004,1344055,Health Care,Biotechnology: Pharmaceutical Preparations
CYTO,Altamira Therapeutics Ltd. Common Shares 0.01 SF (Bermuda),$0.3879,0.0009,0.233%,7833354.00,Bermuda,2014,134583,Health Care,Biotechnology: Pharmaceutical Preparations
CYXT,Cyxtera Technologies Inc. Class A Common Stock,$5.05,-0.50,-9.009%,901760078.00,United States,2020,710094,Technology,Computer Software: Programming Data Processing
CZFS,Citizens Financial Services Inc. Common Stock,$76.245,0.825,1.094%,302726274.00,United States,,1047,Finance,Major Banks
CZNC,Citizens & Northern Corp Common Stock,$23.71,0.09,0.381%,367340358.00,United States,,10758,Finance,Major Banks
CZR,Caesars Entertainment Inc. Common Stock,$46.65,0.39,0.843%,10002549225.00,United States,,3201156,Consumer Discretionary,Hotels/Resorts
CZWI,Citizens Community Bancorp Inc. Common Stock,$12.48,0.12,0.971%,131419579.00,United States,2006,2544,Finance,Savings Institutions
DADA,Dada Nexus Limited American Depositary Shares,$5.64,-0.10,-1.742%,1459652056.00,China,2020,348943,Consumer Discretionary,Department/Specialty Retail Stores
DAIO,Data I/O Corporation Common Stock,$3.25,0.04,1.246%,28652666.00,United States,1981,3961,Technology,Industrial Machinery/Components
DAKT,Daktronics Inc. Common Stock,$2.93,-0.01,-0.34%,131949148.00,United States,1994,81779,Industrials,Office Equipment/Supplies/Services
DALN,DallasNews Corporation Series A Common Stock,$5.01,-0.36,-6.704%,26815975.00,United States,,95516,Consumer Discretionary,Newspapers/Magazines
DALS,DA32 Life Science Tech Acquisition Corp. Class A Common Stock,$9.74,0.00,0.00%,249831000.00,United States,2021,5,Industrials,Consumer Electronics/Appliances
DAOO,Crypto 1 Acquisition Corp Class A Ordinary Shares,$10.01,0.00,0.00%,287787500.00,United States,2022,99,,
DAOOU,Crypto 1 Acquisition Corp Unit,$10.08,0.02,0.199%,0.00,United States,2021,105,,
DAOOW,Crypto 1 Acquisition Corp Warrants,$0.1149,0.00,0.00%,0.00,United States,2022,77769,,
DARE,Dare Bioscience Inc. Common Stock,$1.10,0.02,1.852%,93302944.00,United States,2014,190845,Health Care,Biotechnology: Pharmaceutical Preparations
DATS,DatChat Inc. Common Stock,$0.8616,-0.0484,-5.319%,17746736.00,United States,2021,128996,Technology,Computer Software: Prepackaged Software
DATSW,DatChat Inc. Series A Warrant,$0.2701,-0.0514,-15.988%,0.00,United States,2021,520,Technology,Computer Software: Prepackaged Software
DAVE,Dave Inc. Class A Common Stock,$0.4976,0.0083,1.696%,186353814.00,United States,,2073727,Technology,Retail: Computer Software & Peripheral Equipment
DAVEW,Dave Inc. Warrants,$0.07,-0.0075,-9.677%,0.00,United States,,28495,Technology,Retail: Computer Software & Peripheral Equipment
DAWN,Day One Biopharmaceuticals Inc. Common Stock,$22.78,-0.54,-2.316%,1673443858.00,United States,2021,639800,Health Care,Biotechnology: Pharmaceutical Preparations
DBGI,Digital Brands Group Inc. Common Stock,$0.1274,-0.0026,-2.00%,6736172.00,United States,2021,1324236,Consumer Discretionary,Apparel
DBTX,Decibel Therapeutics Inc. Common Stock,$5.49,0.15,2.809%,137055116.00,United States,2021,52539,Health Care,Biotechnology: Pharmaceutical Preparations
DBVT,DBV Technologies S.A. American Depositary Shares,$2.29,-0.02,-0.866%,430148585.00,France,2014,87651,Health Care,Biotechnology: Pharmaceutical Preparations
DBX,Dropbox Inc. Class A Common Stock,$21.82,-0.19,-0.863%,8047231798.00,United States,2018,1836909,Technology,Computer Software: Prepackaged Software
DCBO,Docebo Inc. Common Shares,$30.34,-0.49,-1.589%,998239975.00,Canada,,47340,,
DCFC,Tritium DCFC Limited Ordinary Shares,$6.23,-0.65,-9.448%,953777296.00,Australia,,1575421,Technology,Electronic Components
DCFCW,Tritium DCFC Limited Warrant,$1.45,-0.0101,-0.692%,0.00,Australia,,29819,Technology,Electronic Components
DCGO,DocGo Inc. Common Stock,$9.96,-0.10,-0.994%,1006211659.00,United States,2020,765246,Health Care,Managed Health Care
DCGOW,DocGo Inc. Warrants,$2.19,-0.03,-1.351%,0.00,United States,2020,32263,Health Care,Managed Health Care
DCOM,Dime Community Bancshares Inc. Common Stock,$31.36,0.57,1.851%,1210415750.00,United States,,106946,Finance,Savings Institutions
DCOMP,Dime Community Bancshares Inc. Fixed-Rate Non-Cumulative Perpetual Preferred Stock Series A,$21.398,0.148,0.696%,0.00,United States,,6004,Finance,Savings Institutions
DCPH,Deciphera Pharmaceuticals Inc. Common Stock,$19.82,0.45,2.323%,1324413745.00,United States,2017,1236886,Health Care,Biotechnology: Pharmaceutical Preparations
DCRD,Decarbonization Plus Acquisition Corporation IV Class A Ordinary Share,$10.015,0.00,0.00%,395905469.00,United States,2021,100,,
DCRDU,Decarbonization Plus Acquisition Corporation IV Unit,$10.04,0.00,0.00%,0.00,United States,2021,15,,
DCRDW,Decarbonization Plus Acquisition Corporation IV Warrant,$0.1999,-0.0101,-4.81%,0.00,United States,2021,3780,,
DCT,Duck Creek Technologies Inc. Common Stock,$12.09,0.10,0.834%,1602785675.00,United States,2020,844100,Technology,Retail: Computer Software & Peripheral Equipment
DCTH,Delcath Systems Inc. Common Stock,$3.91,-0.07,-1.759%,33616937.00,United States,,30443,Health Care,Medical Specialities
DDI,DoubleDown Interactive Co. Ltd. American Depository Shares,$9.71,-0.48,-4.711%,481163902.00,South Korea,2021,11887,Technology,EDP Services
DDOG,Datadog Inc. Class A Common Stock,$95.36,-1.67,-1.721%,30176260712.00,United States,2019,5114284,Technology,EDP Services
DECA,Denali Capital Acquisition Corp. Class A Ordinary Shares,$10.04,-0.01,-0.10%,108657900.00,United States,2022,192573,,
DECAU,Denali Capital Acquisition Corp. Unit,$10.11,0.00,0.00%,0.00,United States,2022,180,,
DECAW,Denali Capital Acquisition Corp. Warrant,$0.08,0.00,0.00%,0.00,United States,2022,9000,,
DENN,Denny's Corporation Common Stock,$10.04,-0.10,-0.986%,581613445.00,United States,,1081995,Consumer Discretionary,Restaurants
DERM,Journey Medical Corporation Common Stock,$3.22,-0.10,-3.012%,56660707.00,United States,2021,16122,Health Care,Biotechnology: Pharmaceutical Preparations
DFFN,Diffusion Pharmaceuticals Inc. Common Stock,$6.27,-0.03,-0.476%,12785282.00,United States,,511,Health Care,Biotechnology: Pharmaceutical Preparations
DFH,Dream Finders Homes Inc. Class A Common Stock,$11.56,0.05,0.434%,1072293335.00,United States,2021,151128,,
DGHI,Digihost Technology Inc. Common Subordinate Voting Shares,$0.90,0.0284,3.258%,24917322.00,Canada,,71677,,
DGICA,Donegal Group Inc. Class A Common Stock,$14.25,-0.24,-1.656%,460615646.00,United States,,61020,Finance,Property-Casualty Insurers
DGICB,Donegal Group Inc. Class B Common Stock,$14.25,-0.21,-1.452%,460615646.00,United States,1986,1422,Finance,Property-Casualty Insurers
DGII,Digi International Inc. Common Stock,$34.86,0.26,0.751%,1230290171.00,United States,1989,311835,Technology,Computer peripheral equipment
DGLY,Digital Ally Inc. Common Stock,$0.5369,-0.0033,-0.611%,25679071.00,United States,,107291,Technology,Security Systems Services
DGNU,Dragoneer Growth Opportunities Corp. III Class A Ordinary Shares,$9.77,0.00,0.00%,525963143.00,United States,2021,75576,Finance,Business Services
DH,Definitive Healthcare Corp. Class A Common Stock,$19.38,-0.07,-0.36%,1947905951.00,United States,2021,256675,Technology,Computer Software: Prepackaged Software
DHACU,Digital Health Acquisition Corp. Unit,$10.30,0.00,0.00%,0.00,United States,2021,605,Industrials,Consumer Electronics/Appliances
DHACW,Digital Health Acquisition Corp. Warrant,$0.16,0.0001,0.063%,0.00,United States,2021,5751,Industrials,Consumer Electronics/Appliances
DHBC,DHB Capital Corp. Class A common stock,$9.82,0.00,0.00%,352906250.00,United States,2021,41638,Industrials,Consumer Electronics/Appliances
DHBCU,DHB Capital Corp. Unit,$9.80,-0.03,-0.305%,352187500.00,United States,2021,19362,Industrials,Consumer Electronics/Appliances
DHBCW,DHB Capital Corp. Warrant,$0.061,0.00,0.00%,0.00,United States,2021,44758,Industrials,Consumer Electronics/Appliances
DHC,Diversified Healthcare Trust Common Shares of Beneficial Interest,$1.30,0.00,0.00%,310860545.00,United States,,2552661,Real Estate,Real Estate Investment Trusts
DHCA,DHC Acquisition Corp. Class A ordinary share,$9.88,0.00,0.00%,382171639.00,United States,2021,5967,Finance,Business Services
DHCAU,DHC Acquisition Corp. Unit,$9.93,-0.02,-0.201%,0.00,United States,2021,7740,Finance,Business Services
DHCAW,DHC Acquisition Corp. Warrant,$0.18,-0.0377,-17.317%,0.00,United States,2021,43364,Finance,Business Services
DHCNI,Diversified Healthcare Trust 5.625% Senior Notes due 2042,$12.81,-0.365,-2.77%,0.00,United States,,13310,Real Estate,Real Estate Investment Trusts
DHCNL,Diversified Healthcare Trust 6.25% Senior Notes Due 2046,$13.15,-0.25,-1.866%,0.00,United States,,44335,Real Estate,Real Estate Investment Trusts
DHHC,DiamondHead Holdings Corp. Class A Common Stock,$9.88,0.02,0.203%,426075000.00,United States,2021,67081,Industrials,Consumer Electronics/Appliances
DHHCU,DiamondHead Holdings Corp. Unit,$9.94,0.04,0.404%,0.00,United States,2021,26256,Industrials,Consumer Electronics/Appliances
DHHCW,DiamondHead Holdings Corp. Warrant,$0.25,0.0199,8.648%,0.00,United States,2021,58997,Industrials,Consumer Electronics/Appliances
DHIL,Diamond Hill Investment Group Inc. Class A Common Stock,$170.99,-1.66,-0.961%,529875268.00,United States,,9550,Finance,Investment Managers
DIBS,1stdibs.com Inc. Common Stock,$7.23,0.21,2.991%,279030535.00,United States,2021,233558,Miscellaneous,Diversified Commercial Services
DICE,DICE Therapeutics Inc. Common Stock,$20.03,0.42,2.142%,765362845.00,United States,2021,642864,Health Care,Biotechnology: Pharmaceutical Preparations
DILA,DILA Capital Acquisition Corp. Class A Common Stock,$9.91,0.02,0.202%,75112597.00,Mexico,2021,102,Industrials,Consumer Electronics/Appliances
DILAW,DILA Capital Acquisition Corp. Warrant,$0.03,-0.02,-40.00%,0.00,Mexico,2021,3599,Industrials,Consumer Electronics/Appliances
DIOD,Diodes Incorporated Common Stock,$65.85,-1.16,-1.731%,2994925562.00,United States,,257377,Technology,Semiconductors
DISA,Disruptive Acquisition Corporation I Class A Ordinary Shares,$9.89,0.00,0.00%,339968750.00,United States,2021,2,Finance,Business Services
DISAU,Disruptive Acquisition Corporation I Unit,$9.89,-0.01,-0.101%,0.00,United States,2021,5014,Finance,Business Services
DISAW,Disruptive Acquisition Corporation I Warrant,$0.0579,0.00,0.00%,0.00,United States,2021,200,Finance,Business Services
DISH,DISH Network Corporation Class A Common Stock,$17.29,0.11,0.64%,9168971738.00,United States,1995,3805054,Consumer Discretionary,Telecommunications Equipment
DJCO,Daily Journal Corp. (S.C.) Common Stock,$260.21,-2.09,-0.797%,358315935.00,United States,,1185,Technology,Retail: Computer Software & Peripheral Equipment
DKDCA,Data Knights Acquisition Corp. Class A Common Stock,$10.36,0.005,0.048%,154987413.00,United Kingdom,2021,410,Industrials,Consumer Electronics/Appliances
DKDCU,Data Knights Acquisition Corp. Unit,$10.40,0.02,0.193%,0.00,United Kingdom,2021,100,Industrials,Consumer Electronics/Appliances
DKNG,DraftKings Inc. Class A Common Stock,$19.22,0.82,4.457%,8621050929.00,United States,2019,30278965,Consumer Discretionary,Services-Misc. Amusement & Recreation
DLCA,Deep Lake Capital Acquisition Corp. Class A Ordinary Shares,$9.935,0.00,0.00%,257068125.00,United States,2021,79,Finance,Business Services
DLCAW,Deep Lake Capital Acquisition Corp. Warrant,$0.0401,-0.025,-38.402%,0.00,United States,2021,42791,Finance,Business Services
DLHC,DLH Holdings Corp.,$14.95,-0.13,-0.862%,193770972.00,United States,,14694,Consumer Discretionary,Business Services
DLO,DLocal Limited Class A Common Shares,$26.77,0.55,2.098%,7918430571.00,Uruguay,2021,1064606,,
DLPN,Dolphin Entertainment Inc. Common Stock,$4.02,0.06,1.515%,38950114.00,United States,,11931,Technology,Interactive Media
DLTH,Duluth Holdings Inc. Class B Common Stock,$7.12,-0.02,-0.28%,237650214.00,United States,2015,167412,Consumer Discretionary,Department/Specialty Retail Stores
DLTR,Dollar Tree Inc. Common Stock,$137.94,-0.07,-0.051%,30889864952.00,United States,1995,1833148,Consumer Discretionary,Department/Specialty Retail Stores
DMAC,DiaMedica Therapeutics Inc. Common Stock,$1.45,-0.14,-8.805%,38342447.00,United States,2018,118921,Health Care, Medicinal Chemicals and Botanical Products 
DMAQ,Deep Medicine Acquisition Corp. Class A Common Stock,$10.06,-0.01,-0.099%,165317992.00,United States,2021,419,Industrials,Consumer Electronics/Appliances
DMAQR,Deep Medicine Acquisition Corp. Rights,$0.135,0.0105,8.434%,0.00,United States,2021,100,,
DMLP,Dorchester Minerals L.P. Common Units Representing Limited Partnership Interests,$28.67,-0.70,-2.383%,1076695371.00,United States,,79790,Energy,Oil & Gas Production
DMRC,Digimarc Corporation Common Stock,$17.37,0.45,2.66%,346891771.00,United States,,86101,Technology,EDP Services
DMTK,DermTech Inc. Common Stock,$5.54,0.06,1.095%,166421301.00,United States,2017,276880,Health Care,Managed Health Care
DNAB,Social Capital Suvretta Holdings Corp. II Class A Ordinary Shares,$9.79,0.00,0.00%,312203100.00,United States,2021,35936,,
DNAD,Social Capital Suvretta Holdings Corp. IV Class A Ordinary Shares,$9.795,0.005,0.051%,312362550.00,United States,2021,7548,Health Care,Biotechnology: Pharmaceutical Preparations
DNAY,Codex DNA Inc. Common Stock,$2.12,0.02,0.952%,62578576.00,United States,2021,28267,Health Care,Medical Specialities
DNLI,Denali Therapeutics Inc. Common Stock,$31.09,0.66,2.169%,3834894543.00,United States,2017,484848,Health Care,Biotechnology: Biological Products (No Diagnostic Substances)
DNUT,Krispy Kreme Inc. Common Stock,$12.29,0.16,1.319%,2057693832.00,United States,2021,832225,Consumer Discretionary,Specialty Foods
DOCU,DocuSign Inc. Common Stock,$60.28,-0.27,-0.446%,12102973130.00,United States,2018,5918622,Technology,EDP Services
