Symbol,Name,Last Sale,Net Change,% Change,Market Cap,Country,IPO Year,Volume,Sector,Industry
JSM,Navient Corporation 6% Senior Notes due December 15 2043,$22.20,-0.07,-0.314%,0.00,United States,,25669,Finance,Finance: Consumer Services
JSPR,Jasper Therapeutics Inc. Common Stock,$1.30,-0.03,-2.256%,47693273.00,United States,2020,395730,Health Care,Biotechnology: Pharmaceutical Preparations
JSPRW,Japer Therapeutics Inc. Warrants,$0.1201,0.0001,0.083%,0.00,United States,2020,2706,Health Care,Biotechnology: Pharmaceutical Preparations
JUGG,Jaws Juggernaut Acquisition Corporation Class A Ordinary Share,$9.83,0.03,0.306%,339135000.00,United States,2021,104922,,
JUGGU,Jaws Juggernaut Acquisition Corporation Unit,$9.8601,0.0101,0.103%,0.00,United States,2021,6050,,
JUPW,Jupiter Wellness Inc. Common Stock,$1.05,0.06,6.061%,22589582.00,United States,2020,574190,Health Care,Biotechnology: Pharmaceutical Preparations
JUPWW,Jupiter Wellness Inc. Warrant,$0.80,-0.095,-10.615%,0.00,United States,2020,1705,Health Care,Biotechnology: Pharmaceutical Preparations
JVA,Coffee Holding Co. Inc. Common Stock,$2.58,0.11,4.453%,14728185.00,United States,2005,36534,Consumer Staples,Specialty Foods
JWAC,Jupiter Wellness Acquisition Corp. Class A Common Stock,$10.02,0.00,0.00%,181913100.00,United States,2022,26,Industrials,Consumer Electronics/Appliances
JWACR,Jupiter Wellness Acquisition Corp. Right,$0.0796,0.00,0.00%,0.00,United States,2022,18,,
JWEL,Jowell Global Ltd. Ordinary Shares,$2.37,0.36,17.91%,74627070.00,China,2021,614095,Consumer Discretionary,Other Consumer Services
JYAC,Jiya Acquisition Corp. Class A Common Stock,$9.965,0.015,0.151%,134000262.00,United States,2020,74875,Industrials,Consumer Electronics/Appliances
JYNT,The Joint Corp. Common Stock,$17.03,0.06,0.354%,246850684.00,United States,2014,127149,,
JZ,Jianzhi Education Technology Group Company Limited American Depositary Shares,$3.61,-0.39,-9.75%,218603550.00,China,2022,3132837,,
JZXN,Jiuzi Holdings Inc. Ordinary Shares,$0.5554,-0.0096,-1.699%,11900469.00,China,2021,208911,Consumer Discretionary,Retail-Auto Dealers and Gas Stations
KACL,Kairous Acquisition Corp. Limited Ordinary Shares,$10.04,0.00,0.00%,101867276.00,Malaysia,2022,59,,
KACLU,Kairous Acquisition Corp. Limited Unit,$10.15,0.02,0.197%,0.00,Malaysia,2021,100,,
KAII,Kismet Acquisition Two Corp. Class A Ordinary Shares,$9.89,0.003,0.03%,289282500.00,United States,2021,223,Finance,Business Services
KAIIU,Kismet Acquisition Two Corp. Unit,$9.905,0.015,0.152%,0.00,United States,2021,1371,Finance,Business Services
KAIIW,Kismet Acquisition Two Corp. Warrant,$0.04,0.00,0.00%,0.00,United States,2021,461,Finance,Business Services
KAIR,Kairos Acquisition Corp. Class A Ordinary Shares,$9.94,0.01,0.101%,342930000.00,United States,2021,189457,Finance,Business Services
KAIRU,Kairos Acquisition Corp. Unit,$9.93,0.00,0.00%,0.00,United States,2021,3000,Finance,Business Services
KAIRW,Kairos Acquisition Corp. Warrant,$0.0488,0.00,0.00%,0.00,United States,2021,1000,Finance,Business Services
KAL,Kalera Public Limited Company Ordinary Shares,$1.85,0.00,0.00%,43381951.00,Ireland,,146713,,
KALA,Kala Pharmaceuticals Inc. Common Stock,$0.3388,0.0068,2.048%,18993082.00,United States,2017,302947,Health Care,Biotechnology: Pharmaceutical Preparations
KALU,Kaiser Aluminum Corporation Common Stock,$74.18,-3.30,-4.259%,1182472224.00,United States,,211712,Industrials,Aluminum
KALV,KalVista Pharmaceuticals Inc. Common Stock,$14.81,-0.26,-1.725%,364355961.00,United Kingdom,2015,196961,Health Care,Biotechnology: Pharmaceutical Preparations
KALWW,Kalera Public Limited Company Warrant,$0.096,0.004,4.348%,0.00,Ireland,,701,,
KARO,Karooooo Ltd. Ordinary Shares,$25.19,0.48,1.943%,779658360.00,Singapore,2021,1788,Technology,Computer Software: Prepackaged Software
KAVL,Kaival Brands Innovations Group Inc. Common Stock,$1.16,-0.02,-1.695%,65156144.00,United States,,146041,Health Care, Medicinal Chemicals and Botanical Products 
KBAL,Kimball International Inc. Class B Common Stock,$7.05,-0.16,-2.219%,259205785.00,United States,,111669,Consumer Discretionary,Industrial Specialties
KBNT,Kubient Inc. Common Stock,$1.26,0.06,5.00%,18145578.00,United States,2020,55088,Technology,EDP Services
KBNTW,Kubient Inc. Warrant,$0.13,0.0002,0.154%,0.00,United States,2020,5987,Technology,EDP Services
KC,Kingsoft Cloud Holdings Limited American Depositary Shares,$2.24,-0.23,-9.312%,547070397.00,China,2020,1876868,Technology,Computer Software: Prepackaged Software
KDNY,Chinook Therapeutics Inc. Common Stock,$21.56,-0.24,-1.101%,1356044206.00,United States,2015,522636,Health Care,Biotechnology: Pharmaceutical Preparations
KDP,Keurig Dr Pepper Inc. Common Stock,$37.23,-0.51,-1.351%,52721837065.00,United States,,8293521,Consumer Staples,Beverages (Production/Distribution)
KE,Kimball Electronics Inc. Common Stock,$19.41,-0.24,-1.221%,477986720.00,United States,,53129,Technology,Industrial Machinery/Components
KELYA,Kelly Services Inc. Class A Common Stock,$14.60,-0.21,-1.418%,554009264.00,United States,,156958,Consumer Discretionary,Diversified Commercial Services
KELYB,Kelly Services Inc. Class B Common Stock,$15.00,0.00,0.00%,569187600.00,United States,,23,Consumer Discretionary,Diversified Commercial Services
KEQU,Kewaunee Scientific Corporation Common Stock,$17.85,-0.35,-1.923%,50519070.00,United States,,5834,Industrials,Medical Specialities
KERN,Akerna Corp. Common Stock,$0.1394,-0.0256,-15.515%,1959784.00,United States,2018,34382432,Health Care,Managed Health Care
KERNW,Akerna Corp Warrant,$0.0405,-0.0347,-46.144%,0.00,United States,2018,108788,Health Care,Managed Health Care
KFFB,Kentucky First Federal Bancorp Common Stock,$7.20,0.00,0.00%,58713804.00,United States,2005,830,Finance,Savings Institutions
KFRC,Kforce Inc. Common Stock,$60.66,0.44,0.731%,1284538950.00,United States,1995,205056,Consumer Discretionary,Diversified Commercial Services
KHC,The Kraft Heinz Company Common Stock,$34.61,-0.35,-1.001%,42412469644.00,United States,,7367665,Consumer Staples,Farming/Seeds/Milling
KIDS,OrthoPediatrics Corp. Common Stock,$49.96,-0.84,-1.654%,1050568322.00,United States,2017,74644,Health Care,Medical/Dental Instruments
KIII,Kismet Acquisition Three Corp. Class A Ordinary Shares,$9.88,0.01,0.101%,360002500.00,United States,2021,78105,Finance,Business Services
KIIIU,Kismet Acquisition Three Corp. Unit,$9.87,0.00,0.00%,0.00,United States,2021,2440,Finance,Business Services
KIIIW,Kismet Acquisition Three Corp. Warrant,$0.03,0.00,0.00%,0.00,United States,2021,8333,Finance,Business Services
KINS,Kingstone Companies Inc. Common Stock,$3.28,-0.05,-1.502%,34917814.00,United States,,9424,Finance,Specialty Insurers
KINZ,KINS Technology Group Inc. Class A Common Stock,$10.07,-0.0001,-0.001%,78929566.00,United States,2021,1129,Industrials,Consumer Electronics/Appliances
KINZW,KINS Technology Group Inc. Warrant,$0.0638,-0.0062,-8.857%,0.00,United States,2021,54146,Industrials,Consumer Electronics/Appliances
KIRK,Kirkland's Inc. COMMONSTOCK,$3.86,0.03,0.783%,49231860.00,United States,2002,641541,Miscellaneous,Diversified Commercial Services
KITT,Nauticus Robotics Inc. Common stock,$6.42,-0.23,-3.459%,0.00,United States,2021,486742,,
KITTW,Nauticus Robotics Inc. Warrant,$0.35,-0.0101,-2.805%,0.00,United States,2021,64056,Industrials,Consumer Electronics/Appliances
KLAC,KLA Corporation Common Stock,$337.36,-9.25,-2.669%,47838921871.00,United States,1980,1577363,Technology,Electronic Components
KLAQ,KL Acquisition Corp Class A Common Stock,$9.89,0.01,0.101%,355421875.00,United States,2021,250327,Industrials,Consumer Electronics/Appliances
KLAQW,KL Acquisition Corp Warrant,$0.0541,-0.0159,-22.714%,0.00,United States,2021,240,Industrials,Consumer Electronics/Appliances
KLIC,Kulicke and Soffa Industries Inc. Common Stock,$41.03,-0.46,-1.109%,2382527783.00,Singapore,,685443,Technology,Semiconductors
KLTR,Kaltura Inc. Common Stock,$2.02,-0.14,-6.481%,265075249.00,United States,2021,268004,Technology,EDP Services
KLXE,KLX Energy Services Holdings Inc. Common Stock,$6.92,-0.22,-3.081%,82860281.00,United States,,104489,Energy,Oilfield Services/Equipment
KMDA,Kamada Ltd. Ordinary Shares,$4.855,0.045,0.936%,217506447.00,Israel,2013,37935,Health Care,Biotechnology: Pharmaceutical Preparations
KMPH,KemPharm Inc. Common Stock,$6.85,0.77,12.664%,236281393.00,United States,,419803,Health Care,Biotechnology: Pharmaceutical Preparations
KNBE,KnowBe4 Inc. Class A Common Stock,$18.44,-0.85,-4.406%,3239860923.00,United States,2021,859404,Technology,Computer Software: Prepackaged Software
KNDI,Kandi Technologies Group Inc Common Stock,$2.13,0.05,2.404%,161391819.00,China,,113883,Consumer Discretionary,Auto Parts:O.E.M.
KNSA,Kiniksa Pharmaceuticals Ltd. Class A Common Stock,$10.47,-0.30,-2.786%,727362407.00,United States,2018,269085,Health Care,Biotechnology: Pharmaceutical Preparations
KNTE,Kinnate Biopharma Inc. Common Stock,$12.19,-0.18,-1.455%,538134608.00,United States,2020,91022,Health Care,Biotechnology: Pharmaceutical Preparations
KNTK,Kinetik Holdings Inc. Class A Common Stock,$38.90,-1.49,-3.689%,5251318882.00,United States,2017,295272,Energy,Oil & Gas Production
KOD,Kodiak Sciences Inc Common Stock,$9.47,0.24,2.60%,492821130.00,United States,2018,417102,Health Care,Biotechnology: Pharmaceutical Preparations
KOPN,Kopin Corporation Common Stock,$1.24,0.01,0.813%,116110326.00,United States,1992,255027,Technology,Industrial Machinery/Components
KOSS,Koss Corporation Common Stock,$7.25,-0.21,-2.815%,66321514.00,United States,,70375,Consumer Staples,Consumer Electronics/Appliances
KPLT,Katapult Holdings Inc. Common Stock,$1.19,-0.04,-3.252%,117070797.00,United States,2019,347546,Technology,EDP Services
KPLTW,Katapult Holdings Inc. Warrant,$0.18,0.0266,17.34%,0.00,United States,2019,26103,Technology,EDP Services
KPRX,Kiora Pharmaceuticals Inc.  Common Stock,$0.2249,-0.0139,-5.821%,8268026.00,United States,,3094587,Health Care,Biotechnology: In Vitro & In Vivo Diagnostic Substances
KPTI,Karyopharm Therapeutics Inc. Common Stock,$5.17,0.42,8.842%,412600205.00,United States,2013,2361605,Miscellaneous,Diversified Commercial Services
KRBP,Kiromic BioPharma Inc. Common Stock,$0.375,0.003,0.806%,5939667.00,United States,2020,11339,Health Care, Medicinal Chemicals and Botanical Products 
KRKR,36Kr Holdings Inc. American Depositary Shares,$1.15,0.06,5.505%,46709007.00,China,2019,1432138,Consumer Discretionary,Business Services
KRMD,KORU Medical Systems Inc. Common Stock,$2.42,0.07,2.979%,108979988.00,United States,,8486,Health Care,Medical/Dental Instruments
KRNL,Kernel Group Holdings Inc. Class A Ordinary Shares,$9.93,0.01,0.101%,378270938.00,United States,2021,1077,Finance,Business Services
KRNLU,Kernel Group Holdings Inc. Units,$9.94,0.02,0.202%,0.00,United States,2021,6154,Finance,Business Services
KRNLW,Kernel Group Holdings Inc. Warrants,$0.034,0.006,21.429%,0.00,United States,2021,2640,Finance,Business Services
KRNT,Kornit Digital Ltd. Ordinary Shares,$30.14,-0.48,-1.568%,1500509773.00,Israel,2015,294386,Industrials,Industrial Machinery/Components
KRNY,Kearny Financial Corp Common Stock,$11.13,0.09,0.815%,759364006.00,United States,2005,257773,Finance,Savings Institutions
KRON,Kronos Bio Inc. Common Stock,$4.79,0.00,0.00%,271923946.00,United States,2020,150680,Health Care, Medicinal Chemicals and Botanical Products 
KROS,Keros Therapeutics Inc. Common Stock,$39.70,-0.15,-0.376%,1022551074.00,United States,2020,177479,Health Care, Medicinal Chemicals and Botanical Products 
KRT,Karat Packaging Inc. Common Stock,$17.64,-0.16,-0.899%,349843836.00,United States,2021,9302,Industrials,Office Equipment/Supplies/Services
KRTX,Karuna Therapeutics Inc. Common Stock,$244.06,0.20,0.082%,8289510103.00,United States,2019,394133,Health Care,Biotechnology: Pharmaceutical Preparations
KRUS,Kura Sushi USA Inc. Class A Common Stock,$71.84,-1.10,-1.508%,699758598.00,United States,2019,47154,Consumer Discretionary,Restaurants
KRYS,Krystal Biotech Inc. Common Stock,$71.29,0.71,1.006%,1829607020.00,United States,2017,76450,Health Care,Biotechnology: Biological Products (No Diagnostic Substances)
KSCP,Knightscope Inc. Class A Common Stock,$2.87,0.10,3.61%,105530155.00,United States,2022,360668,Technology,Security Systems Services
KSI,Kadem Sustainable Impact Corporation Class A common stock,$9.81,0.00,0.00%,214593750.00,United States,2021,2,Industrials,Consumer Electronics/Appliances
KSICU,Kadem Sustainable Impact Corporation Unit,$9.80,-0.01,-0.102%,0.00,United States,2021,1830,Industrials,Consumer Electronics/Appliances
KSPN,Kaspien Holdings Inc. Common Stock,$1.96,-0.11,-5.314%,5157873.00,United States,,497439,Technology,Retail: Computer Software & Peripheral Equipment
KTCC,Key Tronic Corporation Common Stock,$4.40,0.06,1.382%,47352800.00,United States,1983,5792,Technology,Computer peripheral equipment
KTOS,Kratos Defense & Security Solutions Inc. Common Stock,$12.06,-0.16,-1.309%,1518879804.00,United States,,679256,Consumer Discretionary,Ordnance And Accessories
KTRA,Kintara Therapeutics Inc. Common Stock,$0.1585,-0.0015,-0.938%,10645338.00,United States,,902678,Health Care,Biotechnology: Pharmaceutical Preparations
KTTA,Pasithea Therapeutics Corp. Common Stock,$1.20,-0.01,-0.826%,32038426.00,United States,2021,21463,Health Care,Biotechnology: Pharmaceutical Preparations
KTTAW,Pasithea Therapeutics Corp. Warrant,$0.0918,-0.0304,-24.877%,0.00,United States,2021,1570,Health Care,Biotechnology: Pharmaceutical Preparations
KURA,Kura Oncology Inc. Common Stock,$14.60,0.06,0.413%,976637844.00,United States,,755942,Health Care,Biotechnology: Biological Products (No Diagnostic Substances)
KVHI,KVH Industries Inc. Common Stock,$9.52,-0.02,-0.21%,181594562.00,United States,1996,35940,Technology,Radio And Television Broadcasting And Communications Equipment
KVSA,Khosla Ventures Acquisition Co. Class A Common Stock,$9.81,0.0099,0.101%,397206900.00,United States,2021,15407,Industrials,Consumer Electronics/Appliances
KVSC,Khosla Ventures Acquisition Co. III Class A Common Stock,$9.79,0.01,0.102%,614389317.00,United States,2021,16047,Industrials,Consumer Electronics/Appliances
KXIN,Kaixin Auto Holdings Ordinary Shares,$0.72,0.0124,1.752%,142052539.00,China,2017,117531,Finance,Business Services
KYCH,Keyarch Acquisition Corporation Ordinary Shares,$9.895,0.025,0.253%,149612400.00,United States,2022,163543,,
KYCHR,Keyarch Acquisition Corporation Rights,$0.16,0.00,0.00%,0.00,United States,2022,5,,
KYCHU,Keyarch Acquisition Corporation Unit,$10.03,0.00,0.00%,0.00,United States,2022,1100,,
KYMR,Kymera Therapeutics Inc. Common Stock,$28.76,0.95,3.416%,1573337543.00,United States,2020,592949,Health Care, Medicinal Chemicals and Botanical Products 
KZIA,Kazia Therapeutics Limited American Depositary Shares,$1.43,0.07,5.147%,21398041.00,Australia,,74165,Health Care,Biotechnology: Pharmaceutical Preparations
KZR,Kezar Life Sciences Inc. Common Stock,$9.83,-0.56,-5.39%,672072480.00,United States,2018,1363560,Health Care,Biotechnology: Pharmaceutical Preparations
LAAA,Lakeshore Acquisition I Corp. Ordinary Shares,$10.0601,-0.0298,-0.295%,71380685.00,China,2021,2999,,
LAAAW,Lakeshore Acquisition I Corp. Warrant,$0.25,0.0152,6.474%,0.00,China,2021,506,,
LAB,Standard BioTools Inc. Common Stock,$1.32,-0.02,-1.493%,103824339.00,United States,2011,410043,Industrials,Biotechnology: Laboratory Analytical Instruments
LABP,Landos Biopharma Inc. Common Stock,$1.05,0.02,1.942%,42267635.00,United States,2021,185321,Health Care, Medicinal Chemicals and Botanical Products 
LAKE,Lakeland Industries Inc. Common Stock,$11.70,0.13,1.124%,87922283.00,United States,1986,84185,,
LAMR,Lamar Advertising Company Class A Common Stock,$94.75,-0.57,-0.598%,9620403540.00,United States,1996,426463,Real Estate,Real Estate Investment Trusts
LANC,Lancaster Colony Corporation Common Stock,$168.14,-2.46,-1.442%,4627212800.00,United States,,131871,Consumer Staples,Packaged Foods
LAND,Gladstone Land Corporation Common Stock,$21.71,-0.52,-2.339%,742699382.00,United States,2013,298765,Real Estate,Real Estate Investment Trusts
LANDM,Gladstone Land Corporation 5.00% Series D Cumulative Term Preferred Stock,$24.9256,-0.0744,-0.298%,600766931.00,United States,,8638,Real Estate,Real Estate Investment Trusts
LANDO,Gladstone Land Corporation 6.00% Series B Cumulative Redeemable Preferred Stock,$26.25,0.25,0.962%,0.00,United States,,8634,Real Estate,Real Estate Investment Trusts
LARK,Landmark Bancorp Inc. Common Stock,$25.25,0.15,0.598%,125652686.00,United States,,2262,Finance,Major Banks
LASR,nLIGHT Inc. Common Stock,$10.96,-0.24,-2.143%,494246888.00,United States,2018,439619,Technology,Semiconductors
LATG,LatAmGrowth SPAC Class A Ordinary Shares,$10.07,0.00,0.00%,163637500.00,Mexico,2022,126,,
LATGU,LatAmGrowth SPAC Unit,$10.13,0.04,0.396%,0.00,Mexico,2022,11702,,
LATGW,LatAmGrowth SPAC Warrants,$0.1001,-0.0499,-33.267%,0.00,Mexico,2022,10000,,
LAUR,Laureate Education Inc. Common Stock,$11.57,0.29,2.571%,1905154705.00,United States,2017,1358112,Consumer Discretionary,Other Consumer Services
LAX,8i Acquisition 2 Corp. Ordinary Shares,$9.97,0.00,0.00%,110402795.00,Singapore,2021,2,,
LAXXR,8i Acquisition 2 Corp. Rights,$0.2475,0.00,0.00%,0.00,Singapore,2021,98,,
LAXXW,8i Acquisition 2 Corp. Warrant,$0.29,0.00,0.00%,0.00,Singapore,2021,98,,
LAZR,Luminar Technologies Inc.  Class A Common Stock,$9.45,0.56,6.299%,3381983539.00,United States,2019,5470016,Consumer Discretionary,Auto Parts:O.E.M.
LAZY,Lazydays Holdings Inc. Common Stock,$15.43,0.00,0.00%,169021362.00,United States,,64244,Consumer Discretionary,Other Specialty Stores
LBAI,Lakeland Bancorp Inc. Common Stock,$16.70,0.21,1.273%,1082185668.00,United States,,190559,Finance,Major Banks
LBBB,Lakeshore Acquisition II Corp. Ordinary Shares,$10.03,0.004,0.04%,91689245.00,United States,2022,50064,,
LBBBR,Lakeshore Acquisition II Corp. Rights,$0.16,0.00,0.00%,0.00,United States,2022,105,,
LBBBU,Lakeshore Acquisition II Corp. Unit,$10.23,0.03,0.294%,0.00,United States,2022,2319,,
LBBBW,Lakeshore Acquisition II Corp. Warrants,$0.11,-0.0062,-5.336%,0.00,United States,2022,125247,,
LBC,Luther Burbank Corporation Common Stock,$12.64,0.18,1.445%,645586369.00,United States,2017,19635,Finance,Commercial Banks
LBPH,Longboard Pharmaceuticals Inc. Common Stock,$4.30,0.14,3.365%,74026005.00,United States,2021,10906,Health Care,Biotechnology: Pharmaceutical Preparations
LBRDA,Liberty Broadband Corporation Class A Common Stock,$91.43,-2.18,-2.329%,14060533567.00,United States,,457858,Consumer Discretionary,Telecommunications Equipment
LBRDK,Liberty Broadband Corporation Class C Common Stock,$91.71,-2.48,-2.633%,14103593278.00,United States,,1017951,Consumer Discretionary,Telecommunications Equipment
LBRDP,Liberty Broadband Corporation Series A Cumulative Redeemable Preferred Stock,$26.08,0.28,1.085%,0.00,United States,,7319,Consumer Discretionary,Telecommunications Equipment
LBTYA,Liberty Global plc Class A Ordinary Shares,$18.55,-0.27,-1.435%,8992922467.00,United Kingdom,,880929,Telecommunications,Cable & Other Pay Television Services
LBTYB,Liberty Global plc Class B Ordinary Shares,$19.38,0.00,0.00%,9395301208.00,United Kingdom,,30,Telecommunications,Cable & Other Pay Television Services
LBTYK,Liberty Global plc Class C Ordinary Shares,$19.64,-0.27,-1.356%,9521347561.00,United Kingdom,,1430222,Telecommunications,Cable & Other Pay Television Services
LCA,Landcadia Holdings IV Inc. Class A Common Stock,$9.81,0.01,0.102%,613125000.00,United States,2021,178847,Industrials,Consumer Electronics/Appliances
LCAA,L Catterton Asia Acquisition Corp Class A Ordinary Shares,$9.88,0.00,0.00%,353838289.00,Singapore,2021,50012,Finance,Business Services
LCAAU,L Catterton Asia Acquisition Corp Units,$9.87,-0.01,-0.101%,0.00,Singapore,2021,2400,Finance,Business Services
LCAAW,L Catterton Asia Acquisition Corp Warrant,$0.0602,0.0001,0.166%,0.00,Singapore,2021,930,Finance,Business Services
LCAHU,Landcadia Holdings IV Inc. Units,$9.84,0.04,0.408%,0.00,United States,2021,6582,Industrials,Consumer Electronics/Appliances
LCAHW,Landcadia Holdings IV Inc. Warrant ,$0.15,0.00,0.00%,0.00,United States,2021,1000,Industrials,Consumer Electronics/Appliances
LCFY,Locafy Limited Ordinary Share,$0.531,-0.076,-12.521%,10900794.00,Australia,2022,54561,,
LCFYW,Locafy Limited Warrant,$0.1985,0.00,0.00%,0.00,Australia,2022,2,,
LCID,Lucid Group Inc. Common Stock,$16.49,-0.14,-0.842%,27667394257.00,United States,,18962918,Consumer Discretionary,Auto Manufacturing
LCNB,LCNB Corporation Common Stock,$15.24,0.21,1.397%,173054010.00,United States,,10389,Finance,Major Banks
LCUT,Lifetime Brands Inc. Common Stock,$8.28,0.04,0.485%,182634096.00,United States,1991,32636,Consumer Discretionary,Home Furnishings
LDHA,LDH Growth Corp I Class A Ordinary Shares,$9.93,0.00,0.00%,285487500.00,United States,2021,38,Finance,Business Services
LDHAU,LDH Growth Corp I Units,$9.91,0.00,0.00%,0.00,United States,2021,500,Finance,Business Services
LDHAW,LDH Growth Corp I Warrant,$0.0813,0.00,0.00%,0.00,United States,2021,61,Finance,Business Services
LE,Lands' End Inc. Common Stock,$8.42,-0.25,-2.884%,278824620.00,United States,,253274,Consumer Discretionary,Clothing/Shoe/Accessory Stores
LECO,Lincoln Electric Holdings Inc. Common Shares,$136.84,-2.70,-1.935%,7925682075.00,United States,,267440,Industrials,Industrial Machinery/Components
LEDS,SemiLEDS Corporation Common Stock,$2.80,0.04,1.449%,12684431.00,Taiwan,2010,22414,Technology,Semiconductors
LEE,Lee Enterprises Incorporated Common Stock,$18.65,0.15,0.811%,111476925.00,United States,,31407,Consumer Discretionary,Newspapers/Magazines
LEGA,Lead Edge Growth Opportunities Ltd Class A Ordinary Shares,$9.89,0.00,0.00%,426506250.00,United States,2021,19196,Finance,Business Services
LEGAU,Lead Edge Growth Opportunities Ltd Units,$9.905,0.005,0.051%,0.00,United States,2021,15290,Finance,Business Services
LEGAW,Lead Edge Growth Opportunities Ltd Warrant,$0.11,0.00,0.00%,0.00,United States,2021,3225,Finance,Business Services
LEGH,Legacy Housing Corporation Common Stock (TX),$17.01,0.10,0.591%,415146400.00,United States,2018,50510,Consumer Discretionary,Homebuilding
LEGN,Legend Biotech Corporation American Depositary Shares,$43.50,0.01,0.023%,7084881627.00,United States,2020,605391,Health Care,Biotechnology: Pharmaceutical Preparations
LESL,Leslie's Inc. Common Stock,$13.89,0.11,0.798%,2542254531.00,United States,2020,1809122,Consumer Discretionary,
LEXX,Lexaria Bioscience Corp. Common Stock,$2.93,0.03,1.034%,17436424.00,Canada,,13408,Health Care,Biotechnology: Pharmaceutical Preparations
LEXXW,Lexaria Bioscience Corp. Warrant,$0.81,-0.04,-4.706%,0.00,Canada,,348,Health Care,Biotechnology: Pharmaceutical Preparations
LFAC,LF Capital Acquisition Corp. II Class A Common Stock,$10.05,0.00,0.00%,325054688.00,United States,2022,3333,Industrials,Consumer Electronics/Appliances
LFACW,LF Capital Acquisition Corp. II Warrants,$0.106,0.00,0.00%,0.00,United States,2022,1000,Industrials,Consumer Electronics/Appliances
LFLY,Leafly Holdings Inc. Common Stock,$1.28,-0.04,-3.03%,51051511.00,United States,2019,481166,Consumer Staples,Retail-Drug Stores and Proprietary Stores
LFLYW,Leafly Holdings Inc. Warrant,$0.27,0.02,8.00%,0.00,United States,2019,4620,Consumer Staples,Retail-Drug Stores and Proprietary Stores
LFMD,LifeMD Inc. Common Stock,$2.43,-0.09,-3.571%,75209907.00,United States,,47481,Miscellaneous,Diversified Commercial Services
LFMDP,LifeMD Inc. 8.875% Series A Cumulative Perpetual Preferred Stock,$13.9193,-0.0806,-0.576%,0.00,United States,,1512,Miscellaneous,Diversified Commercial Services
LFST,LifeStance Health Group Inc. Common Stock,$8.97,0.55,6.532%,3374348746.00,United States,2021,882288,Health Care,Hospital/Nursing Management
LFTR,Lefteris Acquisition Corp. Class A Common Stock,$9.98,0.00,0.00%,258355923.00,United States,2020,8643,Industrials,Consumer Electronics/Appliances
LFTRU,Lefteris Acquisition Corp. Unit,$9.98,0.02,0.201%,0.00,United States,2020,4883,Industrials,Consumer Electronics/Appliances
LFTRW,Lefteris Acquisition Corp. Warrant,$0.048,0.008,20.00%,0.00,United States,2020,9696,Industrials,Consumer Electronics/Appliances
LFUS,Littelfuse Inc. Common Stock,$218.03,-4.65,-2.088%,5397313027.00,United States,,183315,Technology,Electronic Components
LFVN,Lifevantage Corporation Common Stock (Delaware),$3.91,0.04,1.034%,49081374.00,United States,,33026,Consumer Staples,Farming/Seeds/Milling
LGAC,Lazard Growth Acquisition Corp. I Ordinary Shares,$9.91,-0.01,-0.101%,712281250.00,,2021,751100,Finance,Business Services
LGACU,Lazard Growth Acquisition Corp. I Units,$9.90,-0.02,-0.202%,0.00,,2021,128130,Finance,Business Services
LGACW,Lazard Growth Acquisition Corp. I Warrants,$0.13,0.01,8.333%,0.00,,2021,150000,Finance,Business Services
LGHL,Lion Group Holding Ltd. American Depositary Share,$1.82,0.02,1.111%,85758471.00,China,,377752,Finance,Investment Bankers/Brokers/Service
LGHLW,Lion Group Holding Ltd. Warrant,$0.081,-0.0015,-1.818%,0.00,China,,53028,Finance,Investment Bankers/Brokers/Service
LGIH,LGI Homes Inc. Common Stock,$84.39,-1.43,-1.666%,1963975305.00,United States,2013,185436,Consumer Discretionary,Homebuilding
LGMK,LogicMark Inc. Common Stock,$1.07,0.01,0.943%,10281563.00,United States,,9514,Consumer Discretionary,Diversified Commercial Services
LGND,Ligand Pharmaceuticals Incorporated Common Stock,$90.13,0.62,0.693%,1521642348.00,United States,,156073,Health Care,Biotechnology: Pharmaceutical Preparations
LGO,Largo Inc. Common Shares,$6.14,-0.12,-1.917%,393758200.00,Canada,,42140,,
LGST,Semper Paratus Acquisition Corporation Class A Ordinary Shares,$10.12,0.00,0.00%,485085330.00,United States,2022,2700,,
LGSTU,Semper Paratus Acquisition Corporation Unit,$10.15,0.01,0.099%,0.00,United States,2021,4823,,
